{
  "$schema": "http://json-schema.org/draft-07/schema#",
  "title": "checkpoint",
  "type": "object",
  "additionalProperties": false,
  "required": ["run_id", "side", "state", "canonicalisation", "emitted_utc", "inputs", "units"],
  "properties": {
    "run_id": { "type": "string", "minLength": 1 },
    "side": { "enum": ["source", "target"] },
    "state": { "enum": ["OBSERVE_SOURCE", "OBSERVE_TARGET"] },
    "canonicalisation": { "const": "dec9-half-even-v1" },
    "emitted_utc": { "type": "string", "pattern": "^\\d{4}-\\d{2}-\\d{2}T\\d{2}:\\d{2}:\\d{2}Z$" },
    "harness_patches": {
      "type": "array",
      "items": { "type": "object", "additionalProperties": false,
        "required": ["file", "what", "why"],
        "properties": { "file": {"type": "string"}, "what": {"type": "string"}, "why": {"type": "string"} } }
    },
    "inputs": {
      "type": "array", "minItems": 1,
      "items": { "type": "object", "additionalProperties": false,
        "required": ["name", "bytes", "sha256"],
        "properties": {
          "name": { "type": "string" },
          "bytes": { "type": "integer", "minimum": 0 },
          "sha256": { "type": "string", "pattern": "^[0-9a-f]{64}$" } } }
    },
    "units": {
      "type": "array", "minItems": 1,
      "items": { "type": "object", "additionalProperties": false,
        "required": ["unit", "objects"],
        "properties": {
          "unit": { "type": "string" },
          "objects": {
            "type": "array",
            "items": { "$ref": "#/definitions/obj" } } } }
    }
  },
  "definitions": {
    "digest": {
      "type": "object", "additionalProperties": false,
      "required": ["algorithm", "canonicalisation", "value"],
      "properties": {
        "algorithm": { "const": "SHA-256" },
        "canonicalisation": { "const": "dec9-half-even-v1" },
        "value": { "type": "string", "pattern": "^[0-9a-f]{64}$" }
      }
    },
    "coverage": {
      "type": "object", "additionalProperties": false,
      "required": ["row_count", "field_count", "null_count", "min", "max"],
      "properties": {
        "row_count": { "type": ["integer", "null"] },
        "field_count": { "type": ["integer", "null"] },
        "null_count": { "type": ["integer", "null"] },
        "min": { "type": ["string", "null"] },
        "max": { "type": ["string", "null"] }
      }
    },
    "probe": {
      "type": "object", "additionalProperties": false,
      "required": ["selection_rule", "fields"],
      "properties": {
        "selection_rule": { "type": "string", "minLength": 1 },
        "fields": { "type": "object", "additionalProperties": { "type": "string" } }
      }
    },
    "obj": {
      "type": "object", "additionalProperties": false,
      "required": ["name", "kind", "rows", "cols", "colnames", "canonical_order", "digest", "coverage", "probes"],
      "properties": {
        "name": { "type": "string", "minLength": 1 },
        "kind": { "enum": ["frame", "series", "scalar", "keyed_list"] },
        "rows": { "type": ["integer", "null"] },
        "cols": { "type": ["integer", "null"] },
        "colnames": { "type": "array", "items": { "type": "string" } },
        "keys": { "type": "array", "items": { "type": "string" } },
        "canonical_order": { "type": "array", "items": { "type": "object", "additionalProperties": false,
          "required": ["column", "direction"],
          "properties": { "column": {"type": "string"}, "direction": {"enum": ["asc", "desc"]} } } },
        "digest": { "$ref": "#/definitions/digest" },
        "coverage": { "$ref": "#/definitions/coverage" },
        "probes": { "type": "array", "items": { "$ref": "#/definitions/probe" } }
      }
    }
  }
}
